Number,Date_Time,info,source,Core_info_final,year
128496559599001600,2011-10-24 15:42:21+00:00,Could Airway Abnormality Point to Autism?:  http://on-msn.com/o3BTA9,msnhealthnews,Could Airway Abnormality Point to Autism?:  ,2011
128496558126800896,2011-10-24 15:42:21+00:00,Can NSAIDs Cut Colorectal Cancer Deaths in Older Women?:  http://on-msn.com/oc2nkL,msnhealthnews,Can NSAIDs Cut Colorectal Cancer Deaths in Older Women?:  ,2011
127737734428233730,2011-10-22 13:27:03+00:00,Healthy Halloween Advice for Children With Diabetes:  http://on-msn.com/nvRikp,msnhealthnews,Healthy Halloween Advice for Children With Diabetes:  ,2011
127737732230418432,2011-10-22 13:27:03+00:00,"Nutrition, Hydration Tips Can Give Marathon Runners a Leg Up:  http://on-msn.com/nak73U",msnhealthnews,"Nutrition, Hydration Tips Can Give Marathon Runners a Leg Up:  ",2011
127509541951770624,2011-10-21 22:20:18+00:00,Warning Signs for Health Problems Seen in Young Adults Born Prematurely:  http://on-msn.com/nzNLEU,msnhealthnews,Warning Signs for Health Problems Seen in Young Adults Born Prematurely:  ,2011
127492953575915520,2011-10-21 21:14:23+00:00,Inflamed Adenoids in Kids May Not Be Caused by Stomach Bacteria:  http://on-msn.com/o7xCLc,msnhealthnews,Inflamed Adenoids in Kids May Not Be Caused by Stomach Bacteria:  ,2011
127492952216965120,2011-10-21 21:14:23+00:00,Older Drivers More Cautious Than Younger Ones After Surgery:  http://on-msn.com/oO3yc6,msnhealthnews,Older Drivers More Cautious Than Younger Ones After Surgery:  ,2011
127492949742321665,2011-10-21 21:14:22+00:00,New Animal Study Might Explain Jet Lag Differences:  http://on-msn.com/oEnG3k,msnhealthnews,New Animal Study Might Explain Jet Lag Differences:  ,2011
127492945468342272,2011-10-21 21:14:21+00:00,"Hockey Fistfights Rarely Cause Injuries, Study Claims:  http://on-msn.com/oed9Ct",msnhealthnews,"Hockey Fistfights Rarely Cause Injuries, Study Claims:  ",2011
127492944197468160,2011-10-21 21:14:21+00:00,Blocked Tear Ducts Linked to 'Lazy Eye' in Kids:  http://on-msn.com/r7BbDJ,msnhealthnews,Blocked Tear Ducts Linked to 'Lazy Eye' in Kids:  ,2011
127391721318400004,2011-10-21 14:32:07+00:00,Femara May Beat Tamoxifen at Preventing Breast Cancer's Return:  http://on-msn.com/qXELNb,msnhealthnews,Femara May Beat Tamoxifen at Preventing Breast Cancer's Return:  ,2011
127391719384813570,2011-10-21 14:32:07+00:00,Breast Cancer Risk May Rise With High Hormone Levels:  http://on-msn.com/r7GoS2,msnhealthnews,Breast Cancer Risk May Rise With High Hormone Levels:  ,2011
127391717073747968,2011-10-21 14:32:06+00:00,"Cell Phones Don't Raise Brain Cancer Risk, Study Says:  http://on-msn.com/pHIDym",msnhealthnews,"Cell Phones Don't Raise Brain Cancer Risk, Study Says:  ",2011
127135034330185728,2011-10-20 21:32:08+00:00,Rise in Vulvar Precancers Leads to New Guidelines:  http://on-msn.com/oapzjc,msnhealthnews,Rise in Vulvar Precancers Leads to New Guidelines:  ,2011
127125558218854400,2011-10-20 20:54:29+00:00,Foreclosure Crisis Threatening Americans' Health: Study:  http://on-msn.com/oAVM2G,msnhealthnews,Foreclosure Crisis Threatening Americans' Health: Study:  ,2011
127125556662767617,2011-10-20 20:54:29+00:00,"Teen Drivers Prone to 'G-Force' Errors, Researchers Say:  http://on-msn.com/p3OAnJ",msnhealthnews,"Teen Drivers Prone to 'G-Force' Errors, Researchers Say:  ",2011
127125554989248512,2011-10-20 20:54:28+00:00,Car Crash Injury Risk Greater for Women Drivers: Study:  http://on-msn.com/okLBXD,msnhealthnews,Car Crash Injury Risk Greater for Women Drivers: Study:  ,2011
127087684425490433,2011-10-20 18:23:59+00:00,"U.S. Diet Still Has Too Much Salt, CDC Warns:  http://on-msn.com/owBKZH",msnhealthnews,"U.S. Diet Still Has Too Much Salt, CDC Warns:  ",2011
127087683058143233,2011-10-20 18:23:59+00:00,Hospital Programs to Reduce Antibiotic Resistance Working: Studies:  http://on-msn.com/pyySmz,msnhealthnews,Hospital Programs to Reduce Antibiotic Resistance Working: Studies:  ,2011
127087681615298560,2011-10-20 18:23:59+00:00,"Robins Are 'Super-Spreaders' of West Nile Virus, Expert Says:  http://on-msn.com/obZ6Ho",msnhealthnews,"Robins Are 'Super-Spreaders' of West Nile Virus, Expert Says:  ",2011
127059113485152256,2011-10-20 16:30:27+00:00,Suicide Rates Vary by Region: CDC:  http://on-msn.com/ngqPIu,msnhealthnews,Suicide Rates Vary by Region: CDC:  ,2011
127059112151355393,2011-10-20 16:30:27+00:00,"Food Nutrition Labels Must Be Made Simpler, Experts Say:  http://on-msn.com/r9JWgu",msnhealthnews,"Food Nutrition Labels Must Be Made Simpler, Experts Say:  ",2011
127059110133907457,2011-10-20 16:30:27+00:00,Afraid to Do the Math?:  http://on-msn.com/ob0bGk,msnhealthnews,Afraid to Do the Math?:  ,2011
127059105172045825,2011-10-20 16:30:25+00:00,Inflammatory Bowel Disease Tied to Higher Risk of Post-Op Blood Clots:  http://on-msn.com/pQJzQx,msnhealthnews,Inflammatory Bowel Disease Tied to Higher Risk of Post-Op Blood Clots:  ,2011
127020265547907072,2011-10-20 13:56:05+00:00,Unvaccinated Kids Behind Largest U.S. Measles Outbreak in Years: Study:  http://on-msn.com/oAWa6e,msnhealthnews,Unvaccinated Kids Behind Largest U.S. Measles Outbreak in Years: Study:  ,2011
127020263324925953,2011-10-20 13:56:05+00:00,Flu Shots for Pregnant Women Also Protect Newborns:  http://on-msn.com/oUa4HI,msnhealthnews,Flu Shots for Pregnant Women Also Protect Newborns:  ,2011
127020260766400512,2011-10-20 13:56:04+00:00,Music Aimed at Teens Often Promotes Drinking: Study:  http://on-msn.com/rocMEL,msnhealthnews,Music Aimed at Teens Often Promotes Drinking: Study:  ,2011
126823037680103425,2011-10-20 00:52:23+00:00,Breast Radiation After Lumpectomy Saves Lives: Study:  http://on-msn.com/q3mdT1,msnhealthnews,Breast Radiation After Lumpectomy Saves Lives: Study:  ,2011
126789000857006081,2011-10-19 22:37:08+00:00,"Neighborhood Can Affect Obesity, Diabetes Risk:  http://on-msn.com/ntHUDa",msnhealthnews,"Neighborhood Can Affect Obesity, Diabetes Risk:  ",2011
126788999342858240,2011-10-19 22:37:07+00:00,Start HIV Drug Treatment Early in Patients With TB: Studies:  http://on-msn.com/nvcGM9,msnhealthnews,Start HIV Drug Treatment Early in Patients With TB: Studies:  ,2011
126788998021652480,2011-10-19 22:37:07+00:00,U.S. Man Diagnosed With HIV Develops Leprosy:  http://on-msn.com/nMk4RR,msnhealthnews,U.S. Man Diagnosed With HIV Develops Leprosy:  ,2011
126788996176158720,2011-10-19 22:37:06+00:00,Gene Mapping Reveals Clues to Bedbugs' Pesticide Resistance:  http://on-msn.com/qPg9eC,msnhealthnews,Gene Mapping Reveals Clues to Bedbugs' Pesticide Resistance:  ,2011
126756022533623808,2011-10-19 20:26:05+00:00,Steroids Given to Preemies May Harm Brain Growth: Study:  http://on-msn.com/pVkktG,msnhealthnews,Steroids Given to Preemies May Harm Brain Growth: Study:  ,2011
126756021057228800,2011-10-19 20:26:05+00:00,Care for Mentally Ill Vets at VA Centers May Differ Across U.S.:  http://on-msn.com/nlXJfv,msnhealthnews,Care for Mentally Ill Vets at VA Centers May Differ Across U.S.:  ,2011
126756019379519489,2011-10-19 20:26:04+00:00,New Guidelines Issued for Common Tremor Disorder:  http://on-msn.com/oeYjLG,msnhealthnews,New Guidelines Issued for Common Tremor Disorder:  ,2011
126732077038190592,2011-10-19 18:50:56+00:00,Long-Term Unemployment Can Tax Mental Health:  http://on-msn.com/oh4oaF,msnhealthnews,Long-Term Unemployment Can Tax Mental Health:  ,2011
126732075515654144,2011-10-19 18:50:56+00:00,Teens' IQ May Fluctuate Over Time: Study:  http://on-msn.com/q9WWWV,msnhealthnews,Teens' IQ May Fluctuate Over Time: Study:  ,2011
126698971027615744,2011-10-19 16:39:23+00:00,Health Care-Related Infections Declined in 2010: CDC:  http://on-msn.com/oB7nYn,msnhealthnews,Health Care-Related Infections Declined in 2010: CDC:  ,2011
126698969253429249,2011-10-19 16:39:22+00:00,"Hypertension, Not Blood Pressure Drugs, Linked to Birth Defects:  http://on-msn.com/pRIASU",msnhealthnews,"Hypertension, Not Blood Pressure Drugs, Linked to Birth Defects:  ",2011
126698967571513345,2011-10-19 16:39:22+00:00,Antidepressant Use Skyrocketed in Past 20 Years: CDC:  http://on-msn.com/mOKZLd,msnhealthnews,Antidepressant Use Skyrocketed in Past 20 Years: CDC:  ,2011
126698966153838593,2011-10-19 16:39:22+00:00,Sperm Moves Best for Moderate Exercisers: Study:  http://on-msn.com/mSAbfL,msnhealthnews,Sperm Moves Best for Moderate Exercisers: Study:  ,2011
126657099936710656,2011-10-19 13:53:00+00:00,25 Deaths Now Blamed on Cantaloupe-Linked Listeria Outbreak:  http://on-msn.com/njR48v,msnhealthnews,25 Deaths Now Blamed on Cantaloupe-Linked Listeria Outbreak:  ,2011
126657098565173248,2011-10-19 13:53:00+00:00,"Obese, Asthmatic Kids Need Special Care Under Anesthesia:  http://on-msn.com/rdsUl8",msnhealthnews,"Obese, Asthmatic Kids Need Special Care Under Anesthesia:  ",2011
126469830575521793,2011-10-19 01:28:51+00:00,"More Facebook Friends, More Gray Matter in Brain?:  http://on-msn.com/orTYOd",msnhealthnews,"More Facebook Friends, More Gray Matter in Brain?:  ",2011
126428778300841984,2011-10-18 22:45:44+00:00,Smoking's Effect on Lungs Similar to Cystic Fibrosis: Study:  http://on-msn.com/nCXVlR,msnhealthnews,Smoking's Effect on Lungs Similar to Cystic Fibrosis: Study:  ,2011
126412290026254336,2011-10-18 21:40:13+00:00,Study Links New Dialysis Technology to Rise in Bleeding Risk:  http://on-msn.com/pHqgNv,msnhealthnews,Study Links New Dialysis Technology to Rise in Bleeding Risk:  ,2011
126412288503709697,2011-10-18 21:40:12+00:00,"Fewer Patients Hospitalized for Heart Failure, U.S. Study Finds:  http://on-msn.com/qFqzTy",msnhealthnews,"Fewer Patients Hospitalized for Heart Failure, U.S. Study Finds:  ",2011
126412286352035840,2011-10-18 21:40:12+00:00,"Parents, Doctors Often Differ on  Chemo for Incurable Kids:  http://on-msn.com/o6EBkp",msnhealthnews,"Parents, Doctors Often Differ on  Chemo for Incurable Kids:  ",2011
126378330239938560,2011-10-18 19:25:16+00:00,Promising Malaria Vaccine May Save Children's Lives:  http://on-msn.com/nJR8km,msnhealthnews,Promising Malaria Vaccine May Save Children's Lives:  ,2011
126378328222478338,2011-10-18 19:25:16+00:00,"Link Explored Between Colon Cancer, Bacterium:  http://on-msn.com/rksmXR",msnhealthnews,"Link Explored Between Colon Cancer, Bacterium:  ",2011
126361650017218560,2011-10-18 18:18:59+00:00,Hormonal Treatment of Hot Flashes Still OK for Some: Experts:  http://on-msn.com/nJrc6I,msnhealthnews,Hormonal Treatment of Hot Flashes Still OK for Some: Experts:  ,2011
126361648469516288,2011-10-18 18:18:59+00:00,Katrina's Aftermath: Failed Pregnancies for IVF Moms Nationwide:  http://on-msn.com/paIflU,msnhealthnews,Katrina's Aftermath: Failed Pregnancies for IVF Moms Nationwide:  ,2011
126361646775025664,2011-10-18 18:18:58+00:00,"Breast-Feeding, Vaccinations Lower SIDS Risk, Experts Say:  http://on-msn.com/oSF8LQ",msnhealthnews,"Breast-Feeding, Vaccinations Lower SIDS Risk, Experts Say:  ",2011
126361644669472768,2011-10-18 18:18:58+00:00,'Screen-Free' Play  Best for Toddlers'  Brains:  http://on-msn.com/oVijyC,msnhealthnews,'Screen-Free' Play  Best for Toddlers'  Brains:  ,2011
126293656901648384,2011-10-18 13:48:48+00:00,Weight Loss Surgery Can Help Whole Families: Study:  http://on-msn.com/pAsHtV,msnhealthnews,Weight Loss Surgery Can Help Whole Families: Study:  ,2011
126293655614009344,2011-10-18 13:48:48+00:00,"Report Tracks Patient Outcomes at 5,000 U.S. Hospitals:  http://on-msn.com/pM8Oxr",msnhealthnews,"Report Tracks Patient Outcomes at 5,000 U.S. Hospitals:  ",2011
126293654208917505,2011-10-18 13:48:48+00:00,Factors Identified That May Raise Risk of Early Menopause:  http://on-msn.com/q2Qh0R,msnhealthnews,Factors Identified That May Raise Risk of Early Menopause:  ,2011
126080843318968320,2011-10-17 23:43:10+00:00,"Pap Test Still Best for Cervical Cancer Screening, Experts Say:  http://on-msn.com/n4QKt4",msnhealthnews,"Pap Test Still Best for Cervical Cancer Screening, Experts Say:  ",2011
126046694864453634,2011-10-17 21:27:28+00:00,Less Frequent Mammograms May Lower False-Positive Results:  http://on-msn.com/oZHHPs,msnhealthnews,Less Frequent Mammograms May Lower False-Positive Results:  ,2011
126038734830440448,2011-10-17 20:55:50+00:00,Skin Cancer Check May Come With New  Hairdo:  http://on-msn.com/qKK2M4,msnhealthnews,Skin Cancer Check May Come With New  Hairdo:  ,2011
126006724439179265,2011-10-17 18:48:38+00:00,"Excessive Drinking Costs U.S. Billions, CDC Reports:  http://on-msn.com/pXRCF6",msnhealthnews,"Excessive Drinking Costs U.S. Billions, CDC Reports:  ",2011
126006722732109824,2011-10-17 18:48:38+00:00,Blood Type May Affect Survival After Heart Bypass:  http://on-msn.com/nOMtqL,msnhealthnews,Blood Type May Affect Survival After Heart Bypass:  ,2011
125972698902970368,2011-10-17 16:33:26+00:00,"Healthier Diet, Stronger Sperm?:  http://on-msn.com/oxcMPA",msnhealthnews,"Healthier Diet, Stronger Sperm?:  ",2011
125929220688977920,2011-10-17 13:40:40+00:00,Social Phobia in Teens Goes Beyond Shyness:  http://on-msn.com/oiHGpC,msnhealthnews,Social Phobia in Teens Goes Beyond Shyness:  ,2011
125929218851876864,2011-10-17 13:40:40+00:00,Low-Birthweight Babies at Much Higher Autism Risk:  http://on-msn.com/na32kw,msnhealthnews,Low-Birthweight Babies at Much Higher Autism Risk:  ,2011
125929215865524224,2011-10-17 13:40:39+00:00,It's Easy to Mistake Medicine for Candy:  http://on-msn.com/n6gMM6,msnhealthnews,It's Easy to Mistake Medicine for Candy:  ,2011
125929213617381376,2011-10-17 13:40:38+00:00,Profanity on TV Linked to Foul-Mouthed Kids:  http://on-msn.com/pAHpJf,msnhealthnews,Profanity on TV Linked to Foul-Mouthed Kids:  ,2011
125929210782023680,2011-10-17 13:40:38+00:00,Shift Work May Put Teens at Risk for Multiple Sclerosis:  http://on-msn.com/poBFZt,msnhealthnews,Shift Work May Put Teens at Risk for Multiple Sclerosis:  ,2011
125571069259165696,2011-10-16 13:57:30+00:00,"New ADHD Guidelines Include Preschoolers, Older Teens:  http://on-msn.com/qbC3P3",msnhealthnews,"New ADHD Guidelines Include Preschoolers, Older Teens:  ",2011
125571066604163073,2011-10-16 13:57:29+00:00,Kids Can Be Tougher on Obese Peers:  http://on-msn.com/rrhQCz,msnhealthnews,Kids Can Be Tougher on Obese Peers:  ,2011
125199877528494081,2011-10-15 13:22:31+00:00,Many Don't Believe Their Obesity Poses Health Risks: Study:  http://on-msn.com/q2bDIY,msnhealthnews,Many Don't Believe Their Obesity Poses Health Risks: Study:  ,2011
125199876320542720,2011-10-15 13:22:31+00:00,Fewer Than Half of Kids Hurt in Car Crashes Wearing Seat Belts:  http://on-msn.com/ne7r4C,msnhealthnews,Fewer Than Half of Kids Hurt in Car Crashes Wearing Seat Belts:  ,2011
125199862244450304,2011-10-15 13:22:27+00:00,Kids' Sledding Mishaps Can Cause Serious Head Trauma:  http://on-msn.com/qpgHIJ,msnhealthnews,Kids' Sledding Mishaps Can Cause Serious Head Trauma:  ,2011
124965931385499649,2011-10-14 21:52:54+00:00,Helping Teens Fend Off Attacks by Cyberbullies:  http://on-msn.com/qvTVis,msnhealthnews,Helping Teens Fend Off Attacks by Cyberbullies:  ,2011
124947678332321793,2011-10-14 20:40:22+00:00,"Get Your Flu Shot Now, CDC Urges:  http://on-msn.com/qqTgpp",msnhealthnews,"Get Your Flu Shot Now, CDC Urges:  ",2011
124947677120184320,2011-10-14 20:40:22+00:00,Undergrads' Drinking Patterns May Predict Future Abuse:  http://on-msn.com/powJqG,msnhealthnews,Undergrads' Drinking Patterns May Predict Future Abuse:  ,2011
124927475254951938,2011-10-14 19:20:05+00:00,Foundation Aims to Raise  Awareness of Brain Diseases:  http://on-msn.com/pfCoRM,msnhealthnews,Foundation Aims to Raise  Awareness of Brain Diseases:  ,2011
124927473895997441,2011-10-14 19:20:05+00:00,1 in 6 Cellphones in Britain Contaminated With 'Fecal Matter':  http://on-msn.com/oMRg53,msnhealthnews,1 in 6 Cellphones in Britain Contaminated With 'Fecal Matter':  ,2011
124927472105033728,2011-10-14 19:20:05+00:00,Protein May Help Spot Newborns With Brain Damage:  http://on-msn.com/pa9PUm,msnhealthnews,Protein May Help Spot Newborns With Brain Damage:  ,2011
124927470427308033,2011-10-14 19:20:04+00:00,Hormonal Disorder Linked to Pregnancy Complications: Study:  http://on-msn.com/mOr7TV,msnhealthnews,Hormonal Disorder Linked to Pregnancy Complications: Study:  ,2011
124927468695064576,2011-10-14 19:20:04+00:00,White Kids More Likely to Get CT Scans After Head Trauma:  http://on-msn.com/oTbTwv,msnhealthnews,White Kids More Likely to Get CT Scans After Head Trauma:  ,2011
124630459777945601,2011-10-13 23:39:51+00:00,"For Many, Epilepsy Surgery Effective Long-Term:  http://on-msn.com/qZFi20",msnhealthnews,"For Many, Epilepsy Surgery Effective Long-Term:  ",2011
124630454480539648,2011-10-13 23:39:50+00:00,"Wanted: Spouse With Car, Stocks, Bonds:  http://on-msn.com/q0qgiu",msnhealthnews,"Wanted: Spouse With Car, Stocks, Bonds:  ",2011
124597026137710592,2011-10-13 21:27:00+00:00,Neighborhoods With Busy Intersections Discourage Children's Play:  http://on-msn.com/nuXLMC,msnhealthnews,Neighborhoods With Busy Intersections Discourage Children's Play:  ,2011
124588910042030080,2011-10-13 20:54:45+00:00,"Globally, 2 Million Deaths a Year Linked to Smoky Stoves:  http://on-msn.com/q7OTPy",msnhealthnews,"Globally, 2 Million Deaths a Year Linked to Smoky Stoves:  ",2011
124588908972486657,2011-10-13 20:54:45+00:00,People With Mental Health Issues More Likely to Be Uninsured:  http://on-msn.com/qONX2h,msnhealthnews,People With Mental Health Issues More Likely to Be Uninsured:  ,2011
124588894657331201,2011-10-13 20:54:41+00:00,Could Discrimination Help Trigger Illness in Blacks?:  http://on-msn.com/nF2Vzi,msnhealthnews,Could Discrimination Help Trigger Illness in Blacks?:  ,2011
124555584308641792,2011-10-13 18:42:20+00:00,U.S. Heart Disease Rates Keep Falling: CDC:  http://on-msn.com/onryfk,msnhealthnews,U.S. Heart Disease Rates Keep Falling: CDC:  ,2011
124555583109070848,2011-10-13 18:42:19+00:00,1 in 4 With Psoriasis May Have Undiagnosed Arthritis:  http://on-msn.com/rdW0iL,msnhealthnews,1 in 4 With Psoriasis May Have Undiagnosed Arthritis:  ,2011
124555581779492864,2011-10-13 18:42:19+00:00,Young Children Collaborate Better Than Chimps:  http://on-msn.com/qy0GUS,msnhealthnews,Young Children Collaborate Better Than Chimps:  ,2011
124529729289199616,2011-10-13 16:59:35+00:00,"Overzealous Parents, Coaches Take the Fun From Kids' Sports:  http://on-msn.com/q16OOC",msnhealthnews,"Overzealous Parents, Coaches Take the Fun From Kids' Sports:  ",2011
124529714537824256,2011-10-13 16:59:32+00:00,Smoking Pot Might Up Depression Risk in Vulnerable Teens:  http://on-msn.com/nzEfU5,msnhealthnews,Smoking Pot Might Up Depression Risk in Vulnerable Teens:  ,2011
124480161218428928,2011-10-13 13:42:37+00:00,Use of Asthma Controller Meds on the Rise  Among U.S. Kids:  http://on-msn.com/nAVVd2,msnhealthnews,Use of Asthma Controller Meds on the Rise  Among U.S. Kids:  ,2011
124480159469416448,2011-10-13 13:42:37+00:00,Couples Can Pay a Price for Materialism:  http://on-msn.com/nW2faa,msnhealthnews,Couples Can Pay a Price for Materialism:  ,2011
124480144843870208,2011-10-13 13:42:33+00:00,Why Johnny Won't Go to School:  http://on-msn.com/pvEUBG,msnhealthnews,Why Johnny Won't Go to School:  ,2011
124277002554441729,2011-10-13 00:15:21+00:00,Oral Bacteria Might Signal Early Pancreatic Cancer:  http://on-msn.com/qMFYFf,msnhealthnews,Oral Bacteria Might Signal Early Pancreatic Cancer:  ,2011
124251522417688578,2011-10-12 22:34:06+00:00,23 Deaths From Cantaloupe-Linked Listeria Outbreak: CDC:  http://on-msn.com/pVn6Dh,msnhealthnews,23 Deaths From Cantaloupe-Linked Listeria Outbreak: CDC:  ,2011
124251508597469184,2011-10-12 22:34:02+00:00,Esophageal Cancer Risk Less Dire for Certain Patients: Study:  http://on-msn.com/pHqUap,msnhealthnews,Esophageal Cancer Risk Less Dire for Certain Patients: Study:  ,2011
124251503170027521,2011-10-12 22:34:01+00:00,Rising Global Smoking Rates Could Add Millions of TB Deaths:  http://on-msn.com/pEbF3B,msnhealthnews,Rising Global Smoking Rates Could Add Millions of TB Deaths:  ,2011
124233882248810498,2011-10-12 21:24:00+00:00,Preemies With Faster Brain Growth May End Up Smarter:  http://on-msn.com/oUwPvV,msnhealthnews,Preemies With Faster Brain Growth May End Up Smarter:  ,2011
124233881149906945,2011-10-12 21:24:00+00:00,Blacks Fare Worse Than Whites After Colon Cancer Surgery:  http://on-msn.com/oDPTI6,msnhealthnews,Blacks Fare Worse Than Whites After Colon Cancer Surgery:  ,2011
124233880084553732,2011-10-12 21:23:59+00:00,"Survival Less Likely for Black Victims of Assault, Study Finds:  http://on-msn.com/poLID4",msnhealthnews,"Survival Less Likely for Black Victims of Assault, Study Finds:  ",2011
124201368977293312,2011-10-12 19:14:48+00:00,"Genome of Cancer-Free Rodent  May Give Clues to Human Aging, Disease:  http://on-msn.com/pngwZU",msnhealthnews,"Genome of Cancer-Free Rodent  May Give Clues to Human Aging, Disease:  ",2011
124201367849017344,2011-10-12 19:14:48+00:00,Genome of 'Black Death' Bacterium Sequenced:  http://on-msn.com/nUimri,msnhealthnews,Genome of 'Black Death' Bacterium Sequenced:  ,2011
124201365777035264,2011-10-12 19:14:47+00:00,Research Sheds Light on Vitamin D's Role in Immunity:  http://on-msn.com/rn3CYY,msnhealthnews,Research Sheds Light on Vitamin D's Role in Immunity:  ,2011
124176590522429440,2011-10-12 17:36:20+00:00,More Teen Males Using Condoms When They First Have Sex: Survey:  http://on-msn.com/nKMw2u,msnhealthnews,More Teen Males Using Condoms When They First Have Sex: Survey:  ,2011
124176589268324352,2011-10-12 17:36:20+00:00,Regular Exercise Seems to Guard Against Migraine:  http://on-msn.com/oHYWsK,msnhealthnews,Regular Exercise Seems to Guard Against Migraine:  ,2011
124176586957266944,2011-10-12 17:36:20+00:00,Certain After-Stroke Treatments May Boost Outcome:  http://on-msn.com/o1Wf0k,msnhealthnews,Certain After-Stroke Treatments May Boost Outcome:  ,2011
124127271643648001,2011-10-12 14:20:22+00:00,Pot Smoking May More Than Double Crash Risk:  http://on-msn.com/rlVU5u,msnhealthnews,Pot Smoking May More Than Double Crash Risk:  ,2011
123913039014674433,2011-10-12 00:09:05+00:00,Many on Medical Guideline Panels Have Conflicts of Interest: Study:  http://on-msn.com/n0ById,msnhealthnews,Many on Medical Guideline Panels Have Conflicts of Interest: Study:  ,2011
123913037500526593,2011-10-12 00:09:04+00:00,Where Folks Live Plays Role in Health Disparities: Study:  http://on-msn.com/oxfQ3H,msnhealthnews,Where Folks Live Plays Role in Health Disparities: Study:  ,2011
123880966476398592,2011-10-11 22:01:38+00:00,Evidence Lacking That Cognitive Rehab Therapy Helps Brain-Injured Vets:  http://on-msn.com/p1vsE0,msnhealthnews,Evidence Lacking That Cognitive Rehab Therapy Helps Brain-Injured Vets:  ,2011
123880964991619072,2011-10-11 22:01:38+00:00,Healthy Diet May Counteract Heart Disease Gene:  http://on-msn.com/qpwPMS,msnhealthnews,Healthy Diet May Counteract Heart Disease Gene:  ,2011
123880950210891776,2011-10-11 22:01:34+00:00,Children of Older Dads Fare as Well in School as Other Kids:  http://on-msn.com/n5ZB6F,msnhealthnews,Children of Older Dads Fare as Well in School as Other Kids:  ,2011
123864847308951552,2011-10-11 20:57:35+00:00,Folic Acid in Pregnancy May Prevent Kids' Language Delays:  http://on-msn.com/oyQtxj,msnhealthnews,Folic Acid in Pregnancy May Prevent Kids' Language Delays:  ,2011
123864845778034688,2011-10-11 20:57:35+00:00,Extra Vitamin E May Be Associated With Prostate Cancer:  http://on-msn.com/p1zhHf,msnhealthnews,Extra Vitamin E May Be Associated With Prostate Cancer:  ,2011
123864842221264897,2011-10-11 20:57:34+00:00,Mutant Gene That Ups Risk for Ovarian Cancer May Aid Survival:  http://on-msn.com/pc5SSZ,msnhealthnews,Mutant Gene That Ups Risk for Ovarian Cancer May Aid Survival:  ,2011
123864840983949312,2011-10-11 20:57:34+00:00,Lasers Safe for Removal of Pacemaker Wires in Elderly: Study:  http://on-msn.com/pVTzik,msnhealthnews,Lasers Safe for Removal of Pacemaker Wires in Elderly: Study:  ,2011
123832233588047873,2011-10-11 18:47:59+00:00,Ginger Supplements Might Ease Inflammation Linked to Colon Cancer:  http://on-msn.com/q1Aznc,msnhealthnews,Ginger Supplements Might Ease Inflammation Linked to Colon Cancer:  ,2011
123832230891098112,2011-10-11 18:47:59+00:00,Women Say Mammograms Give Them Sense of Control: Survey:  http://on-msn.com/pNrgUB,msnhealthnews,Women Say Mammograms Give Them Sense of Control: Survey:  ,2011
123807614235709442,2011-10-11 17:10:10+00:00,Direct-to-Consumer Gene Tests Cause Little Anxiety: Study:  http://on-msn.com/qF8D5R,msnhealthnews,Direct-to-Consumer Gene Tests Cause Little Anxiety: Study:  ,2011
123758335429316610,2011-10-11 13:54:21+00:00,Study Suggests Origins of Pregnancy-Linked High Blood Pressure:  http://on-msn.com/pLwz9L,msnhealthnews,Study Suggests Origins of Pregnancy-Linked High Blood Pressure:  ,2011
123758333852270592,2011-10-11 13:54:20+00:00,Men With Disabilities More Vulnerable to Sexual Assault:  http://on-msn.com/q60ypF,msnhealthnews,Men With Disabilities More Vulnerable to Sexual Assault:  ,2011
123758332321337345,2011-10-11 13:54:20+00:00,Environmental Toxins Linked to Hardening of Arteries:  http://on-msn.com/rnvgN8,msnhealthnews,Environmental Toxins Linked to Hardening of Arteries:  ,2011
123516508847616001,2011-10-10 21:53:25+00:00,Washing the Body 'Cleanses' the Mind:  http://on-msn.com/pw1oEz,msnhealthnews,Washing the Body 'Cleanses' the Mind:  ,2011
123516507534794752,2011-10-10 21:53:24+00:00,"When Others Dislike You, Your Pain Doesn't Matter:  http://on-msn.com/pVYT5b",msnhealthnews,"When Others Dislike You, Your Pain Doesn't Matter:  ",2011
123500566100971521,2011-10-10 20:50:04+00:00,Diabetes Education Seems to Help Improve Blood Sugar Control:  http://on-msn.com/n4OoQ5,msnhealthnews,Diabetes Education Seems to Help Improve Blood Sugar Control:  ,2011
123500564876230657,2011-10-10 20:50:03+00:00,New Alzheimer's Drug Shows Early Promise:  http://on-msn.com/owoaP4,msnhealthnews,New Alzheimer's Drug Shows Early Promise:  ,2011
